{
  "id": "kiro-cli-agent",
  "name": "Kiro CLI",
  "version": "0.1.0",
  "description": "Kiro CLI as a native AI agent via the Agent Client Protocol.",
  "repository": "https://github.com/Sizk/kiro-cli-agent",
  "authors": [
    "Sizk <https://github.com/Sizk>"
  ],
  "license": "Apache-2.0",
  "icon": "./icon.svg",
  "distribution": {
    "binary": {
      "darwin-aarch64": {
        "archive": "https://github.com/Sizk/kiro-cli-agent/releases/download/v0.1.0/kiro-cli-agent-darwin-arm64.tar.gz",
        "cmd": "./kiro-cli-wrapper.sh"
      },
      "linux-x86_64": {
        "archive": "https://github.com/Sizk/kiro-cli-agent/releases/download/v0.1.0/kiro-cli-agent-linux-x64.tar.gz",
        "cmd": "./kiro-cli-wrapper.sh"
      },
      "linux-aarch64": {
        "archive": "https://github.com/Sizk/kiro-cli-agent/releases/download/v0.1.0/kiro-cli-agent-linux-arm64.tar.gz",
        "cmd": "./kiro-cli-wrapper.sh"
      }
    }
  }
}
