{
  "id": "openclaw",
  "name": "OpenClaw",
  "version": "2026.1.29",
  "description": "Personal AI assistant with an ACP bridge",
  "repository": "https://github.com/openclaw/openclaw",
  "authors": [
    "Peter Steinberger"
  ],
  "license": "MIT",
  "distribution": {
    "npx": {
      "package": "openclaw@2026.1.29",
      "args": [
        "acp"
      ]
    }
  }
}
