{
  "id": "waibee",
  "name": "Waibee Code",
  "version": "0.1.8",
  "description": "Fast, terminal-first AI coding agent. Multi-session, shell-aware permissions, MCP, skills, hooks, and plugins.",
  "repository": "https://github.com/waibee-main/waibee-code",
  "website": "https://github.com/waibee-main/waibee-code",
  "license": "proprietary",
  "authors": ["Waibee"],
  "distribution": {
    "binary": {
      "darwin-aarch64": {
        "archive": "https://github.com/waibee-main/waibee-code/releases/download/v0.1.8/waibee-0.1.8-aarch64-apple-darwin.tar.gz",
        "cmd": "./waibee",
        "args": ["acp"]
      },
      "darwin-x86_64": {
        "archive": "https://github.com/waibee-main/waibee-code/releases/download/v0.1.8/waibee-0.1.8-x86_64-apple-darwin.tar.gz",
        "cmd": "./waibee",
        "args": ["acp"]
      },
      "linux-aarch64": {
        "archive": "https://github.com/waibee-main/waibee-code/releases/download/v0.1.8/waibee-0.1.8-aarch64-unknown-linux-gnu.tar.gz",
        "cmd": "./waibee",
        "args": ["acp"]
      },
      "linux-x86_64": {
        "archive": "https://github.com/waibee-main/waibee-code/releases/download/v0.1.8/waibee-0.1.8-x86_64-unknown-linux-gnu.tar.gz",
        "cmd": "./waibee",
        "args": ["acp"]
      },
      "windows-aarch64": {
        "archive": "https://github.com/waibee-main/waibee-code/releases/download/v0.1.8/waibee-0.1.8-aarch64-pc-windows-msvc.zip",
        "cmd": "./waibee.exe",
        "args": ["acp"]
      },
      "windows-x86_64": {
        "archive": "https://github.com/waibee-main/waibee-code/releases/download/v0.1.8/waibee-0.1.8-x86_64-pc-windows-msvc.zip",
        "cmd": "./waibee.exe",
        "args": ["acp"]
      }
    }
  }
}
