{
  "id": "zencode",
  "name": "ZenCODE",
  "version": "3.1.0",
  "description": "Native-Swift coding agent: one binary with no Node runtime, sub-agents with per-task model bindings, any OpenAI-compatible endpoint or local DS4 inference.",
  "repository": "https://github.com/gerardogrisolini/ZenCODE",
  "website": "https://github.com/gerardogrisolini/ZenCODE/blob/main/Docs/why-zen.md",
  "authors": ["Gerardo Grisolini"],
  "license": "MIT",
  "license_url": "https://github.com/gerardogrisolini/ZenCODE/blob/main/LICENSE",
  "distribution": {
    "binary": {
      "darwin-aarch64": {
        "archive": "https://github.com/gerardogrisolini/ZenCODE/releases/download/v3.1.0/zen-3.1.0-macos-arm64.tar.gz",
        "sha256": "aadb4cd3d6678f9e6023ae34328a338ddf85f624c400bbd298da609ad9cfc7b6",
        "cmd": "./zen",
        "args": ["--acp"]
      }
    }
  }
}
