{
  "id": "qwen-code",
  "name": "Qwen Code",
  "version": "0.26.4",
  "description": "Alibaba's Qwen coding assistant",
  "repository": "https://github.com/QwenLM/qwen-code",
  "website": "https://qwenlm.github.io/qwen-code-docs/en/users/overview",
  "authors": [
    "Alibaba Qwen Team"
  ],
  "license": "Apache-2.0",
  "license_url": "https://github.com/QwenLM/qwen-code/blob/main/LICENSE",
  "distribution": {
    "npx": {
      "package": "@qwen-code/qwen-code@0.26.4",
      "args": [
        "--acp",
        "--experimental-skills"
      ]
    }
  }
}
