{
  "id": "vtcode",
  "name": "VT Code",
  "version": "0.107.0",
  "description": "An open-source coding agent with LLM-native code understanding and robust shell safety. Supports multiple LLM providers with automatic failover and efficient context management.",
  "repository": "https://github.com/vinhnx/VTCode",
  "website": "https://github.com/vinhnx/VTCode/blob/main/docs/guides/zed-acp.md",
  "authors": ["vinhnx"],
  "license": "MIT",
  "license_url": "https://github.com/vinhnx/VTCode/blob/main/LICENSE",
  "distribution": {
    "binary": {
      "darwin-aarch64": {
        "archive": "https://github.com/vinhnx/VTCode/releases/download/0.107.0/vtcode-0.107.0-aarch64-apple-darwin.tar.gz",
        "cmd": "./vtcode",
        "args": ["acp"],
        "env": {
          "VT_ACP_ENABLED": "1",
          "VT_ACP_ZED_ENABLED": "1"
        }
      },
      "darwin-x86_64": {
        "archive": "https://github.com/vinhnx/VTCode/releases/download/0.107.0/vtcode-0.107.0-x86_64-apple-darwin.tar.gz",
        "cmd": "./vtcode",
        "args": ["acp"],
        "env": {
          "VT_ACP_ENABLED": "1",
          "VT_ACP_ZED_ENABLED": "1"
        }
      },
      "linux-x86_64": {
        "archive": "https://github.com/vinhnx/VTCode/releases/download/0.107.0/vtcode-0.107.0-x86_64-unknown-linux-gnu.tar.gz",
        "cmd": "./vtcode",
        "args": ["acp"],
        "env": {
          "VT_ACP_ENABLED": "1",
          "VT_ACP_ZED_ENABLED": "1"
        }
      },
      "windows-x86_64": {
        "archive": "https://github.com/vinhnx/VTCode/releases/download/0.107.0/vtcode-0.107.0-x86_64-pc-windows-msvc.zip",
        "cmd": "vtcode.exe",
        "args": ["acp"],
        "env": {
          "VT_ACP_ENABLED": "1",
          "VT_ACP_ZED_ENABLED": "1"
        }
      }
    }
  }
}
