{
  "id": "gemini",
  "name": "Gemini CLI",
  "version": "0.65.0",
  "description": "Google's official CLI for Gemini",
  "repository": "https://github.com/google-gemini/gemini-cli",
  "website": "https://geminicli.com",
  "authors": [
    "Google"
  ],
  "license": "Apache-2.0",
  "license_url": "https://github.com/google-gemini/gemini-cli/blob/main/LICENSE",
  "distribution": {
    "npx": {
      "package": "@google/gemini-cli@0.65.0",
      "args": [
        "--acp"
      ]
    }
  }
}
