{
  "id": "factory-droid",
  "name": "Factory Droid",
  "version": "0.245.1",
  "description": "Factory Droid - AI coding agent powered by Factory AI",
  "website": "https://factory.ai/product/cli",
  "authors": [
    "Factory AI"
  ],
  "license": "proprietary",
  "license_url": "https://factory.ai/legal/terms",
  "distribution": {
    "npx": {
      "package": "droid@0.245.1",
      "args": [
        "exec",
        "--output-format",
        "acp"
      ],
      "env": {
        "DROID_DISABLE_AUTO_UPDATE": "true",
        "FACTORY_DROID_AUTO_UPDATE_ENABLED": "false"
      }
    }
  }
}
