{
  "id": "amp-acp",
  "name": "Amp",
  "version": "0.11.0",
  "description": "ACP wrapper for Amp - the frontier coding agent",
  "repository": "https://github.com/tao12345666333/amp-acp",
  "authors": [
    "tao12345666333"
  ],
  "license": "Apache-2.0",
  "license_url": "https://github.com/tao12345666333/amp-acp/blob/main/LICENSE",
  "icon": "./icon.svg",
  "distribution": {
    "binary": {
      "darwin-aarch64": {
        "archive": "https://github.com/tao12345666333/amp-acp/releases/download/v0.11.0/amp-acp-darwin-aarch64.tar.gz",
        "cmd": "./amp-acp",
        "sha256": "4bf329d06ffa80123f88324cf27260054bfda6ad952eb4337c30747ad9618ad8"
      },
      "darwin-x86_64": {
        "archive": "https://github.com/tao12345666333/amp-acp/releases/download/v0.11.0/amp-acp-darwin-x86_64.tar.gz",
        "cmd": "./amp-acp",
        "sha256": "0e016273310457f5dbd145962473625645f2bfe490f8fa47d4e9ced4a42a97a2"
      },
      "linux-aarch64": {
        "archive": "https://github.com/tao12345666333/amp-acp/releases/download/v0.11.0/amp-acp-linux-aarch64.tar.gz",
        "cmd": "./amp-acp",
        "sha256": "fa77d0b4379f89c33fb6cf346b49149c09e48c9e0358d997e0267d846e0a8930"
      },
      "linux-x86_64": {
        "archive": "https://github.com/tao12345666333/amp-acp/releases/download/v0.11.0/amp-acp-linux-x86_64.tar.gz",
        "cmd": "./amp-acp",
        "sha256": "57642a7d6e80015cffab263e84c05cde2283b1aa5c80349d0161124f1df24a81"
      },
      "windows-x86_64": {
        "archive": "https://github.com/tao12345666333/amp-acp/releases/download/v0.11.0/amp-acp-windows-x86_64.zip",
        "cmd": "amp-acp.exe",
        "sha256": "908add2112197527c8a3e303721c5edccf73b1d85daf55e6911c3fb6ac07f00a"
      }
    }
  }
}
