{
  "id": "argy-code",
  "name": "Argy Code",
  "version": "2.8.1",
  "description": "AI coding agent for the terminal. Implements ACP over stdio. Supports session management, real-time tool call streaming, file edits, permission delegation, and MCP servers. Authenticate with `argy auth login` or ARGY_PAT.",
  "repository": "https://github.com/demkada/argy-code",
  "authors": [
    "Argy Cloud <support@argy.cloud>"
  ],
  "license": "Proprietary",
  "distribution": {
    "binary": {
      "darwin-aarch64": {
        "archive": "https://github.com/demkada/argy-code/releases/download/v2.8.1/argy-darwin-arm64.zip",
        "cmd": "./argy",
        "args": [
          "acp"
        ]
      },
      "darwin-x86_64": {
        "archive": "https://github.com/demkada/argy-code/releases/download/v2.8.1/argy-darwin-x64.zip",
        "cmd": "./argy",
        "args": [
          "acp"
        ]
      },
      "linux-aarch64": {
        "archive": "https://github.com/demkada/argy-code/releases/download/v2.8.1/argy-linux-arm64.tar.gz",
        "cmd": "./argy",
        "args": [
          "acp"
        ]
      },
      "linux-x86_64": {
        "archive": "https://github.com/demkada/argy-code/releases/download/v2.8.1/argy-linux-x64.tar.gz",
        "cmd": "./argy",
        "args": [
          "acp"
        ]
      },
      "windows-x86_64": {
        "archive": "https://github.com/demkada/argy-code/releases/download/v2.8.1/argy-windows-x64.zip",
        "cmd": "argy.exe",
        "args": [
          "acp"
        ]
      }
    },
    "npx": {
      "package": "@argy-cloud/code@2.8.1",
      "args": [
        "acp"
      ]
    }
  }
}
