{
  "id": "mistral-vibe",
  "name": "Mistral Vibe",
  "version": "3.0.4",
  "description": "Mistral's open-source coding assistant",
  "repository": "https://github.com/mistralai/mistral-vibe",
  "website": "https://mistral.ai/products/vibe",
  "authors": [
    "Mistral AI"
  ],
  "license": "Apache-2.0",
  "license_url": "https://github.com/mistralai/mistral-vibe/blob/main/LICENSE",
  "icon": "./icon.svg",
  "distribution": {
    "binary": {
      "darwin-aarch64": {
        "archive": "https://github.com/mistralai/mistral-vibe/releases/download/v3.0.4/vibe-acp-darwin-aarch64-3.0.4.tar.gz",
        "cmd": "./vibe-acp",
        "sha256": "cc9c1d94ccb7890b36e82b096031e80d6c78d68f891e527e01c0865a04f90008"
      },
      "darwin-x86_64": {
        "archive": "https://github.com/mistralai/mistral-vibe/releases/download/v3.0.4/vibe-acp-darwin-x86_64-3.0.4.tar.gz",
        "cmd": "./vibe-acp",
        "sha256": "9f94678a670b9c13b5f20bc4878075b37f9ba537bec32cbccee45ff8e78e165e"
      },
      "linux-aarch64": {
        "archive": "https://github.com/mistralai/mistral-vibe/releases/download/v3.0.4/vibe-acp-linux-aarch64-3.0.4.tar.gz",
        "cmd": "./vibe-acp",
        "sha256": "dfac99ccd25de9780f54f0dc32aa90a3838810a0becc8f7fe393ea07748d3107"
      },
      "linux-x86_64": {
        "archive": "https://github.com/mistralai/mistral-vibe/releases/download/v3.0.4/vibe-acp-linux-x86_64-3.0.4.tar.gz",
        "cmd": "./vibe-acp",
        "sha256": "83d9cd21758a99719382e1c8c55420e9693d7e3358b3d3a744727e2291a9d5b3"
      },
      "windows-x86_64": {
        "archive": "https://github.com/mistralai/mistral-vibe/releases/download/v3.0.4/vibe-acp-windows-x86_64-3.0.4.zip",
        "cmd": "./vibe-acp.exe",
        "sha256": "e853cc56f586bf3e618d2d82eca5659db2f781f070252b24ea273f6c156b5aec"
      }
    }
  }
}
